{
  "watchlist_id": "wl_fixed_income_liquidity",
  "record_id": "000121390026042594",
  "event_id": null,
  "match_score": 0.375,
  "matched_terms": [
    "bid-ask spread",
    "market depth",
    "market functioning"
  ],
  "thesis_signal": "neutral",
  "created_at": "2026-04-16T19:51:45.964348+00:00"
}