{
  "watchlist_id": "wl_policy_repricing",
  "record_id": "000119312526143960",
  "event_id": null,
  "match_score": 0.5,
  "matched_terms": [
    "rate cut",
    "rate hike",
    "terminal rate",
    "policy path"
  ],
  "thesis_signal": "neutral",
  "created_at": "2026-04-13T19:51:24.256961+00:00"
}